"tweet_id","text","query","user_id","user_name","follower_count","user_tweet_count","likes","retweets","location_name","latitude","longitude","user_location","date"
1346916123342589952,"no election was ridge you only believed lies from the crookest president in history donald j trump sore losers","president",986792935,"",5,737,0,0,"",NA,NA,"","2021-01-06"
1346916123048988672,"i thought donald trump was our law and order president","president",29492363,"",540,48292,0,8,"",NA,NA,"","2021-01-06"
1346916122684235776,"people also gathering at the minnesota state capitol in support of president trump mnleg tptalmanac","president",1028079203634348032,"",509,16722,0,19,"",NA,NA,"NY","2021-01-06"
1346916122642276352,"a supporter of president donald trump sits inside the office of speaker of the house nancy pelosi as he protests inside the us capitol more photos","president",983107476,"",125,10082,0,2196,"",NA,NA,"","2021-01-06"
1346916122625515520,"resigntrump you to blame for all this chaos because you a sore loserand on january 20 you wont be president anymore","president",780214246361530368,"",142,22097,1,0,"",NA,NA,"","2021-01-06"
1346916122365464576,"now someone is shot this is all your fault trump you are not a president","president",2569744747,"",10,124,0,0,"",NA,NA,"NJ","2021-01-06"
1346916122029936640,"donald j trump is the worst president we ever had period","president",866933521,"",146,1273,0,3,"",NA,NA,"","2021-01-06"
1346916121891500032,"trump protesters vice president pence is a constitutional officer he must be protected his safety is critical and important to this country","president",822374936895516672,"",5015,97554,0,157,"",NA,NA,"USA","2021-01-06"
1346916121853747200,"arkansas leaders are reacting to news that protrump supporters breached the countrys capitol during a joint session with congress to confirm joe biden as president","president",1320033782,"jade jackson",12624,77511,0,6,"",NA,NA,"AR","2021-01-06"
1346916121769889792,"too late rubio you are part of this trump world you are to blame among w mitchell and the rest of non american politicians who need to get the hell out of congress too late rubio the president aint listening","president",1301980653882310656,"",0,4,0,0,"",NA,NA,"","2021-01-06"
1346916121652375552,"lets pray to god it does start a civil war the united states needs to go back to the greatness we once enjoyed in 1783 i stand with president trump and the civilwar2","president",1265303005584404480,"",4,163,2,0,"",NA,NA,"","2021-01-06"
1346916121396523008,"no national guard just unreal we know that peaceful protests that the president doesnt support would have been overrun this is a government building amp supremacist terrorists are given free reign wake up world capitol dcprotests dc capitolbuilding trumpterrorists","president",45021556,"",1466,84257,1,0,"",NA,NA,"","2021-01-06"
1346916121350430720," just called this note from president trump total cowardice","president",14862668,"",6133,165746,0,6,"",NA,NA,"NY","2021-01-06"
1346916121212018688,"last summer i asked you to your face to condemn white supremacist terrorism enabled by trump and you refused even now you wont accept biden as president amp support trump despite his loss even now you wont call this an act of terrorism amp condemn it your silence led to this","president",1295198970990538752,"",387,291,0,180,"",NA,NA,"","2021-01-06"
1346916121090396160,"thousands of protrump protesters flocked to the nations capital today in support of president trumps demand that vice president mike pence and congress block joe bidens presidential victory","president",836264074447052800,"",158,267,0,407,"",NA,NA,"","2021-01-06"
1346916120368918528,"presidentelect joe biden to comment shortly on todays attack on us capitol an attack implicitly but not explicitly egged on by president trump who urged supporters to take their protest to the capitol","president",347991132,"",393,4773,0,33,"",NA,NA,"","2021-01-06"
1346916119932792832,"cruz you are an embarrassment and in four years youll be out of the senate no you wont be presidentyou will be another loserjust like trump the man who humiliated you and your family and now you like his ugly fat orange ass you need to be tried for sedition","president",617588655,"",420,1137,0,0,"",NA,NA,"NY","2021-01-06"
1346916119412695040,"defying us president donald trump vicepresident mike pence said that he does not have the power to discard electoral votes that will make joe biden the next president","president",985685642,"",123,619,0,27,"",NA,NA,"","2021-01-06"
1346916119173595136," a republican and trump ally to cnn this is insane i have not seen anything like this since i deployed to iraq in 2007 and 2008 the president needs to call it off like call it off call it off its over the elections over","president",506348428,"",4528,14979,0,37,"",NA,NA,"","2021-01-06"
1346916118896783360,"trump rally live in dc president donald trump at save america rally at via","president",362436552,"",47,5591,0,0,"",NA,NA,"","2021-01-06"
1346916118594727936,"the fact that outgoing president trump has mobilised and encouraged acts of terrorism in washington dc is astonishing and must be condemned in the strongest possible way i really hope a peaceful resolution can be found truly heartbreaking scenes emerging from the united states","president",2792589217,"",8094,66769,9,2,"",NA,NA,"","2021-01-06"
1346916118489747456,"chaos you said holy shit this is ugly we should have worn our colors clearly open the box of sins and wrongs president trump we the people are ready","president",32562145,"",294,3877,0,0,"",NA,NA,"","2021-01-06"
1346916118334681088,"the extremist violence at the capitol is undemocratic and a direct result of leaders including president trump enabling dangerous conspiracy theories at the highest levels those behind this attack on our democracy need to be held accountable","president",1147630551555334144,"",72,165,0,149,"",NA,NA,"","2021-01-06"
1346916118083072000,"armed insurrection attempted coup by president trump and his armed supporters from cnn i have no idea who is speaking","president",1361893171,"",146,1019,0,0,"",NA,NA,"FL","2021-01-06"
1346916118053740544,"rep mike gallagher demands trump call it off mr president","president",1157765096933855232,"",56,3256,0,8,"",NA,NA,"","2021-01-06"
1346916117747552256,"fuck maga fuck these stupid cops who so very clearly are hesitating because the protesters are white and fuck donald trump for being the biggest piece of shit weve ever been forced to call a president","president",987324930139328512,"",5277,64114,0,8,"",NA,NA,"","2021-01-06"
1346916116459884544,"just in president donald trump is asking for protesters to remain peaceful and avoid violence","president",20627332,"khqa news",13464,86781,0,2,"",NA,NA,"IL","2021-01-06"
1346916116300488704,"the uk supports you mr president trumprally","president",1210327471234662400,"",96,3599,0,0,"",NA,NA,"","2021-01-06"
1346916116140941312,"so cute the proud boys committing treason think stopping the electoral process means trump stays in office nope trump leaves jan 20 at noon if no new president is decided nancy pelosi becomes acting president until biden is sworn in so look at how many want nancy in charge","president",92999280,"",399,49885,0,0,"",NA,NA,"","2021-01-06"
1346916116124327936,"for the sake of fairnessinterviewers on multiple networks are speaking to people on the ground near the capitol who are there for the sake of being therenot for the president not all those present are protrump a 6 pm curfew is in place","president",280840486,"victoria idoni",24878,12029,13,2,"",NA,NA,"IL","2021-01-06"
1346916114601803776,"trump deliberately wants this to be happening if he cant be president fair and square he will let his conspiracy theorists wrangle it for him and will tell the national guard to stand down and let it happen","president",140829551,"",171,61053,0,81,"",NA,NA,"AL","2021-01-06"
1346916114266279936,"if you had any doubt that donald trump is the worst american president in history this ends the argument","president",20615444,"",164,5946,1,0,"",NA,NA,"","2021-01-06"
1346916114211606528,"we are a nation of laws and rules except when the president is the biggest breaker of both disruption is the theme of his administration trumpisacriminal for peace you can stop this","president",1164043342855847936,"",520,3418,0,1,"",NA,NA,"","2021-01-06"
1346916113842581504,"trump and the republicans encourage americans to hate americans america is self destructing wow history what do you expect when the president plants paranoid propaganda trump let the farright populists out of the closet stand proud and tall america","president",289397067,"",1054,2190,0,1,"",NA,NA,"","2021-01-06"
1346916113460977664," on cnn right now call it off mr president call it off call it off its over now calling trump a coward he calls the insurrection a coup","president",126067190,"",7117,16519,8,1,"",NA,NA,"","2021-01-06"
1346916113435795456,"the president must be impeached now this is a blatant coup attempt by trump and his supporters","president",263401847,"",338,1433,8,0,"",NA,NA,"MA","2021-01-06"
1346916113360310272,"trump just became the first president to commit terrorism in his own country","president",38582138,"",6277,39900,0,108,"",NA,NA,"NY","2021-01-06"
1346916112815030272,"because dc is the only us territory where the national guard answers directly to the president any state can deploy their own troops but not dc trump himself is denying them","president",20805595,"",60,10840,0,0,"",NA,NA,"PA","2021-01-06"
1346916112798248960,"even as trump still refuses to condemn president putin of russia americas governments computers have been breached by putins people","president",629134569,"",5,194,0,0,"",NA,NA,"CA","2021-01-06"
1346916112638816256,"im trying to be more selective with any explicit political commentary and i may regret this but with all due respect senator you enabled this by your refusal to accept the election results and your doubling down with president trump frankly sir you have no room to speak","president",450377918,"",52,818,0,4,"",NA,NA,"USA","2021-01-06"
1346916112273973248,"time for you to face this this is trump supporters incited by the president","president",1285978065953337344,"",4,125,0,0,"",NA,NA,"","2021-01-06"
1346916112106078208,"jake tapper on cnn now calling this a coup by president trump","president",67460504,"",412,55820,1,0,"",NA,NA,"AZ","2021-01-06"
1346916111850340352,"when president trump the president of america can not stop corruption in us election and can not even investigate the fraud happened during election this mean america is been lost to the evil corrupted political establishment and american people are been sold to their enemies","president",1103694806319054848,"",814,141884,0,1,"",NA,NA,"","2021-01-06"
1346916111313465344,"one of the violent trump protesters who stormed into the us capitol building is now sitting in the chair of the president of the senate","president",54729285,"",1074,35462,0,66,"",NA,NA,"MA","2021-01-06"
1346916111250558976,"president trump we will never give up we will never concede yet trump doesnt have to concede because in hours this election process will be officially over presidentelect joe biden will come into office in 14 days and trump will be complaining as a private citizen","president",3283517004,"",1506,31300,0,1772,"",NA,NA,"","2021-01-06"
1346916110529130496,"watch president trump says robert e lee was a great general during ohio rally calling the confederate leader incredible","president",1314965402808713216,"",427,10428,0,2329,"",NA,NA,"","2021-01-06"
1346916110264922112,"time to change america democrats because donald trump is president and theres a fucking barbarian on camera","president",1253195971,"",97,29282,0,0,"",NA,NA,"LA","2021-01-06"
1346916110071984128,"if true presidentelect biden making a statement ahead of the president trump","president",81852590,"",1940,160636,0,5,"",NA,NA,"OH","2021-01-06"
1346916110009069568,"you trump started this mob and you need to stop it resign immediately you are a failed president","president",926573496,"",9,7,0,0,"",NA,NA,"","2021-01-06"
1346916109816111104,"man trump supporters blow my mind yall are some psychos basically worshipping amp risking your life for this so called president","president",1074840875698655232,"",47,1766,0,23,"",NA,NA,"TX","2021-01-06"
1346916109623111680,"if we dont hold trump accountable for election fraud and extortion the president acted properly folks will continue to undermine our democracy there needs to be consequences impeach him now","president",1327430353833889792,"",6,664,0,327,"",NA,NA,"","2021-01-06"
1346916109350481920,"happening where leaders country were conducting appropriate transfer of power just couple hours ago our president incited a mob to raid the halls of our democracy trump said he would walk with them this would be what a coup insurrection if not usa wed be calling it that","president",793560323609460736,"",313,263021,0,223,"",NA,NA,"NY","2021-01-06"
1346916109191176192,"also its not like youre losing anything when biden becomes president hes not gonna take anything away from u biden and trump literally a piece of the same coin you dumb fcks","president",3365203889,"",264,14620,0,0,"",NA,NA,"","2021-01-06"
1346916109157507072,"they never stopped fighting the civil war where northern bluestate liberals liberated their niras the people pass but their dna survives thats why these keep returning generation to generation abomination to abomination trump is their dnas president","president",1275352464942907392,"",3,188,0,0,"",NA,NA,"","2021-01-06"
1346916108805304320,"cnn just called this an attempted coup by president trump and his supporters","president",1314609899498860544,"",400,413,0,0,"",NA,NA,"TX","2021-01-06"
1346916108754890752,"president trump now leaves office with really nothing but a string of failures having lost the house majority the senate majority and the white house after being impeached for abusing the presidency","president",277377430,"",978,24309,0,3651,"",NA,NA,"FL","2021-01-06"
1346916108369014784,"yes the greatest threat to the united states is the president of the united states amp his enablers the gopseditioustraitors trumpterrorism pass it on","president",119748934,"",509,31366,0,128,"",NA,NA,"NC","2021-01-06"
1346916108197105664,"hundreds of supporters of president donald trump stormed the grounds of the us capitol on wednesday as a joint session of congress met to certify the results of the 2020 election via i wonder how many of them will get shot in the back","president",15265204,"",21,1549,0,0,"",NA,NA,"USA","2021-01-06"
1346916108092235776,"if trump was the president of nigeria or any of such countries pretending to be democratic nations he would refuse to hand over to biden dem never born am well to stay a second longer than 12pm 4 white house come 20th january","president",168592585,"",2699,469203,0,29,"",NA,NA,"","2021-01-06"
1346916107979022336,"romney it turns out telling voters the election is rigged is not a good way to turn out your voterspresident trump has disrespected the american voters has dishonored the election system and has disgraced the office of the presidency","president",1483970810,"",544,6710,0,3129,"",NA,NA,"","2021-01-06"
1346916107656028160,"maga mob in washingtondc this is what anarchy looks like so much for trump being a law amp order president his supporters in the capitol are terrorists sadly the residents of dc are going to suffer for it tonite amp in days to come hangintheredc","president",1311439416167198720,"",15,476,0,0,"",NA,NA,"VA","2021-01-06"
1346916106905255936,"a supporter of us president donald trump sits at a desk after invading the capitol building on january 6 2021 in washington dc afp via getty","president",488007183,"",514,12165,0,19,"",NA,NA,"","2021-01-06"
1346916106599100416," on pres trumps tweet attacking mike pence the presidents supporters had already attacked capitol police lines while all of that was going on the president took to twitterand attacked his vice president that was his first action","president",64384113,"",1071,28492,0,412,"",NA,NA,"NC","2021-01-06"
1346916106196422656,"hey shut trumps account down now you should not give a fuck if he is still technically the president hes inciting violence trumprally shuttrumpdown insane","president",1542195302,"",1342,93303,0,96,"",NA,NA,"","2021-01-06"
1346916106150289408,"president trump call this off right now any injuries or worse deaths are on you","president",3044561340,"",10,14,0,0,"",NA,NA,"","2021-01-06"
1346916105109921792,"domesticterrorists are there at their presidents request call them what they are stay safe magaiscancelled rightwingterrorists trumpisacriminal trumpisanationaldisgrace","president",1047719977090830336,"",426,57316,0,74,"",NA,NA,"NV","2021-01-06"
1346916104355110912,"president trump needs to tell his supporters to stand down peacefully storming the us capitol to overthrow our electoral process is antidemocratic anarchy this will have lasting implications long after trump is gone the national guard needs to peacefully send the crowd home","president",1098715143322722304,"",100,583,0,287,"",NA,NA,"TX","2021-01-06"
1346916104174710784,"ive asked the white house for a comment from president trump on the chaos unfolding on capitol hill right now by a mob wearing maga sweatshirts and waving trump flags no response yet","president",82302714,"",52,101,0,1508,"",NA,NA,"","2021-01-06"
1346916103621124096,"the amount of ignorance i see in dc right now is honestly annoying as fuck but the fact that trump isnt gonna be president anymore makes me feel better cause these mfs still gone be mad at the end of this protest","president",285965165,"",860,60987,0,1,"",NA,NA,"","2021-01-06"
1346916103419813888,"breaking republican senator mitt romney blames president trump for insurrection via jonathan martin of the new york times","president",2826725826,"",194,5108,0,909,"",NA,NA,"","2021-01-06"
1346916103243575296,"trump just started a riot please repost this when the country isnt being attack by the out going president","president",23779231,"",216,4127,0,0,"",NA,NA,"NJ","2021-01-06"
1346916102698381312,"for a party that is all about law and order the fact that they cant accept the fact that president trump lost the election is quite interesting mitch mcconnell moscow mitch even said that them overturning the election would be detrimental to democracy in this country","president",177118131,"",708,59583,0,0,"",NA,NA,"IL","2021-01-06"
1346916102526414848,"president trump needs some doses of these to calm his frail nerves until 20th january joebidenisyourpresident","president",38243236,"",271,400,0,0,"",NA,NA,"","2021-01-06"
1346916102123757568,"dc mayor muriel bowser has issued a citywide curfew from 6 pm wednesday to 6 am thursday following the invasion of the capitol by protesters backing president donald trumps baseless claims of election fraud","president",15945641,"",33182,80932,3,3,"",NA,NA,"DC","2021-01-06"
1346916101645484032,"president trump and those refusing to accept the result of the election are fully responsible for inciting this type of violence","president",188464831,"",353,235272,0,11,"",NA,NA,"","2021-01-06"
1346916100727042048,"mr pence this is insanity you know what your duty is your president has put you specifically you in danger let alone all the other members of congress trump is unfit do what you know is right do not protect this man who will not protect you or the country please","president",1189657451911618560,"",6,411,2,0,"",NA,NA,"","2021-01-06"
1346916100513144832,"sanders called trump the most dangerous president in us modern history he was right","president",813079740856893440,"",2001,260889,0,16,"",NA,NA,"OK","2021-01-06"
1346916099296788480,"is this what president trump meant when he said stand back and stand by","president",2450725903,"",262,13677,0,39,"",NA,NA,"","2021-01-06"
1346916099145814016,"resign this is on you and gop enabling a terrorist president fuck you america wont forget this gop killed itself off today by allowing trump free reign and causing this domestic terrorism act led by trump 25thamendmentnow removetrumpnow twittershutdowntrump","president",1162438880924241920,"",195,3318,0,0,"",NA,NA,"","2021-01-06"
1346916098877382656,"bitch all this time trump was president leftist couldnt do shit like this but these right wing nutters can","president",61904714,"",208,4310,2,0,"",NA,NA,"OH","2021-01-06"
1.346916098483e+18,"we the people love you mr president we admire your courage and determination to listen to us and defend our rights thank you president trump for defending the constitution respecting us and fighting for us you are our president all 50 states are red","president",402370024,"",763,5482,89,12,"",NA,NA,"","2021-01-06"
1346916098386649088,"the president of the united states donald trump is a terrorist pass it on trumpisaterrorist impeachtrump impeachtrumpagain trumpcult trumpcoupattempt trumpisacompletefailure washingtondc capitol trumpcrimefamily gopseditioustraitors republicansaredestroyingamerica","president",4887608170,"",21,568,1,1,"",NA,NA,"CO","2021-01-06"
1346916098143367168,"trump sics maga masses on congress president sends rallygoers to storm capitol hill triggering lockdown and pandemonium","president",1221556511794769920,"",754,1963,0,16,"",NA,NA,"SC","2021-01-06"
1346916096629235712,"whats happening at the capitol right now is exactly why trump shouldnt be president","president",1300619672916824064,"",543,52022,0,47,"",NA,NA,"","2021-01-06"
1346916096222359552,"president trump has incited violence to end the long tradition of a peaceful transfer of power treasonous behavior by an american president","president",2415895334,"",130,12175,0,344,"",NA,NA,"","2021-01-06"
1346916096109113344,"sir president trump it is your duty to support and stand behind a nation of free law however chaos and unruly behavior should not be condoned show the that you have the power the authority and the influence to bring peace on our land and abroad","president",1346911054823968768,"",0,22,0,0,"",NA,NA,"","2021-01-06"
1346916095844904960,"has there ever been a president that has had such a horribly devoted fan club as this one so dangerous and gutwrenching i dont think so and thats such a huge fucking problem trump supporters has become a trademark title it should be illegal to let that happen","president",2194970100,"",3202,20703,27,0,"",NA,NA,"","2021-01-06"
1346916095492501504,"trump supporters breach capitol hill following his encouragement when a populist and unprofessional politician becomes president and refuses to transfer power peacefully ushotwinter americandemocracy","president",1066253827194740736,"",27438,861,399,55,"",NA,NA,"","2021-01-06"
1346916095349968896,"trump is still president yall still controls the secret service which helps police dc still controls park police still controls national guard thats why people are using the coup word hes still in charge","president",169525667,"",2454,124398,0,42,"",NA,NA,"CA","2021-01-06"
1346916095299473408,"president trump is not telling them to leave telling them to remain peaceful we are following the constitution of saving our country its the best option considering the corruption","president",1198079992472539136,"",1232,10765,0,0,"",NA,NA,"","2021-01-06"
1346916094498451456,"this is what the trump legacy will be rabid fascist mobs storming the capitol of the worlds oldest democracy and forcing the peoples representatives to evacuate the process will go on joe biden will be the president but trump will own this disgrace through all of history","president",450712216,"",328,32822,0,5,"",NA,NA,"DC","2021-01-06"
1346916094301380608,"weak ass mother f trump didnt tell them to leave and denied the request to deploy the national guard to make them leave the president does not want peace he wants this violent chaos to continue","president",818008890,"",413,1204,0,108,"",NA,NA,"","2021-01-06"
1346916094129291264,"cnn just called this an armed insurrection and attempted coup by president trump and his supporters im glad theyre finally calling it exactly what it is","president",987774220326191104,"",794,44393,65,3,"",NA,NA,"","2021-01-06"
1346916093823246336,"stop this madness president trump call these people off they are vandalizing our countrys capital this is not what our country stands for","president",71591848,"",13,45,0,0,"",NA,NA,"","2021-01-06"
1346916093634424832,"president trump is calling out joe and hunter bidens corruption with ukraine russia and china","president",3796144275,"",539,91938,0,297,"",NA,NA,"","2021-01-06"
1346916093525434368,"if youre not sure about what this is playing out here is how the headline would be written if it were happening overseas presidents party attempts coup as his supporters try to storm capitol to keep trump in power","president",193874686,"",148,26432,0,1543,"",NA,NA,"FL","2021-01-06"
1346916093231820800,"despite suggesting multiple times he was going to march to capitol hill after his speech president trump just returned to the white house many of his supporters are on their way","president",40244956,"",243,22497,0,2189,"",NA,NA,"OH","2021-01-06"
1346916090962579456,"as trump loyalists and police clash outside the capitol building you can spot blood on the ground tensions high in dc after us president trumps speech refusing to concede the election","president",719391526191702016,"",49,66730,0,759,"",NA,NA,"","2021-01-06"
1346916090694144000,"the footage shows these terrorists literally just wandering through the corridors of the capitol like a party of tourists president trump unleashed this cnn","president",1007258389,"",710,7160,0,52,"",NA,NA,"","2021-01-06"
