"tweet_id","text","query","user_id","user_name","follower_count","user_tweet_count","likes","retweets","location_name","latitude","longitude","user_location","date"
1346808577986596864,"trump legacy violence death sedition from npr news massive 1year rise in homicide rates collided with the pandemic in 2020","death rates",1333951681730666496,"",588,3143,0,1,"",NA,NA,"","2021-01-06"
1346764582442954752,"yet your lot dont give a damn for the worse preventable corvid19 death rates in the world by the criminally negligent trump 350k millions going hungry and loosing their jobs whilst the billionaires are getting richer under trump","death rates",884725084371521536,"",1086,124535,0,0,"",NA,NA,"","2021-01-06"
1346819050295369728,"dear starting at 1pm on the 20th rs will blame you and ds for all harm covid economy national security everything you must combat their disinformation with truth telling how all our problems are from trump and gop bore all with repetition daily","covid",948521737,"",13712,55683,17,5,"",NA,NA,"","2021-01-06"
1346819046583513088,"fabulous article but not surprising of trumps and wh attitude the indifference toward citizens during this horrific covid is indefensible by all gop such unnecessary suffering for our people due to trumpgop incompetence yes trump is accountable","covid",1321761401430560768,"",20,10270,0,1,"",NA,NA,"","2021-01-06"
1346819043966267392,"young healthy senator who spoke at rallies packed wthousands wo masks who supports trump whos downplayed covid amp mocked those who wear masks is 1st to get vaccine while most medical workers elderly amp infirm americans wait congratulations on ur privilege ","covid",32728220,"",67,2920,0,27379,"",NA,NA,"","2021-01-06"
1346819038522073088,"hey mick i went through your timeliness and didnt see a single post about the 50000 families that have died of covid as a matter of fact i went through mine yours and at least 100 other peoples and none of us have plenty of legit things to critique trump on but this aint 1","covid",366963972,"",108,1448,40,2,"",NA,NA,"AL","2021-01-06"
1346819029336526848,"trumps covid stimulus bill how it affects food andnutrition","covid",24212723,"",144709,8128,12,4,"",NA,NA,"NY","2021-01-06"
1346819014471933952,"wealthy donors received vaccines through florida nursing home last moments of trumps party of breathtaking corruption and evil","covid",1274069473,"",122,12105,0,0,"",NA,NA,"","2021-01-06"
1346819003721916416,"madness and a covid 19 super spreader event which is trumps specialty","covid",4756186311,"",255,24421,0,0,"Brooklyn, NY",-74.041878,40.570842,"USA","2021-01-06"
1346819000651677696,"on dec 15 mcconnell publicly acknowledged bidens victory a week later trump blasted covidrelief deal making pointless demand for 2k checks that night i said on it appeared he wanted to hurt mcconnell on the way out damaging ga senate candidates checks out so far","covid",883413656997961728,"",391,30960,0,291,"",NA,NA,"","2021-01-06"
1346818954438709248,"president trump is so smartpeople will start awakening to this truth","covid",1293770120334958592,"",586,1207,1,0,"West Hollywood, CA",-118.3959042,34.075963,"CA","2021-01-06"
1346818922478231552,"i went back to december 13 on president trumps twitter timeline i did not see a single hint of compassion for the families of the 50000 americans who have died from covid since that day the president seems incapable of compassion january 20th cant come soon enough","covid",2331337885,"",822,58478,0,1255,"",NA,NA,"","2021-01-06"
1346818906762211328,"my mil is being transported to hospice this morning my 82 yr old mom is in the hospital with covid my dad is in quarantine we celebrated our 40th anniversary with frozen pizza and donald trump is trying to overthrow our government hows 2021 going for you","covid",63258820,"",990,58757,0,183,"",NA,NA,"PA","2021-01-06"
1346818875548057600,"cvs says it expects to finish first round of covid vaccines in nursing homes by jan 25 breakingnews news china trump biden photo biotechandpharmaceuticals biotechnology breakingnewsbusiness business businessnews cnbcbusiness coronavir","covid",1098227094864183296,"",1630,10584,0,0,"",NA,NA,"USA","2021-01-06"
1346818832434933760,"jail for trump the covid19 trump","covid",1270377355136155648,"",30,14687,0,0,"",NA,NA,"","2021-01-06"
1346818826328006656,"instead of sending more money for djt to put in his pocket give it to the food banks to help people through the covid crisis trump is yesterdays news","covid",809982722,"",1443,3264,3,0,"",NA,NA,"","2021-01-06"
1346818821219299328,"you still support a man who plays golf while thousands are weekly dying from covid a man who refuses to investigate the slaughter of a journalist you and trump are much alike lindsey and history will paint you with the same strokes a coward without integrity or a soul","covid",824329393841512448,"",53,3691,0,0,"",NA,NA,"","2021-01-06"
1346818807642402816,"president trump signs covid19 aid bill that includes 900 billion in pandemic relief for individuals and businesses read here","covid",801536030532915200,"",769,1496,0,0,"",NA,NA,"","2021-01-06"
1346818797504765952,"almost 4000 people reported yesterday to have died of covid trump holding this weird rally just to show how little he cares for his citizens lives","covid",40865257,"",440,32973,0,0,"",NA,NA,"","2021-01-06"
1346818772636733440,"the lastditch protrump rally in downtown dc began with a speaker encouraging trump fans to spread covid to each other really","covid",539573373,"",3711,376033,0,909,"",NA,NA,"","2021-01-06"
1346818757763751936,"trump only cares about these races in ga insofar as it reflects on him its all about trump 247 thats why at his rally he only talked about his bogus voter frrud claims barely mentioned the senate candidates amp didnt say a word about the georgians dying from covid19 sad","covid",1321995501433196544,"",9,1050,0,41,"",NA,NA,"","2021-01-06"
1346818721998901248,"concern about covid coming from boomer who downplayed covid for the past year what a joke god bless the family of the guy boomer was referring to but boomer trumpism is the last guy to talk how serious covid is","covid",89345165,"",499,11992,0,0,"",NA,NA,"USA","2021-01-06"
1346818719637495808,"pennsylvanias gop refused to seat a duly elected state senator today we cannot just move on from trump trumpism remains alive and well sapping our country of her lifeblood just like covid it must be eradicated decorous dems need to be firm relentless in meting out justice","covid",1606799396,"",5254,139443,0,2326,"",NA,NA,"TX","2021-01-06"
1346818707847327744,"ds must never forget what went on here or move on ds must forever remind americans that this is the gop a party that tried to take our democracy down in service to a con man who never should have been president never forget 911 covidand the rtrump assault on democracy","covid",741035667136913408,"",21,5612,1,0,"",NA,NA,"","2021-01-06"
1346818697374130176,"and with all the gop voters who are dying because trump convinced them to expose themselves to covid and the party split what are the chances pence can stump up winning votes in 2024 another life ruined by trump worlds smallest","covid",1689305016,"",82,33807,1,0,"",NA,NA,"","2021-01-06"
1346818694614290432,"translation its all about meeeeee come get covid trump supporters please take note that this is what your fuhrer thinks of you","covid",461614862,"",480,7500,2,1,"",NA,NA,"NC","2021-01-06"
1346818688859648000,"yay two busloads of stupid gullible white people hop into enclosed spaces to support a disease trumpism amp spread one covid next stop intensive care it would be funny if only they got sick but they will come in contact with innocent people who didnt vote for a criminal","covid",93789081,"",133,13800,0,43,"",NA,NA,"","2021-01-06"
1346818688176054272,"dems have two years two years to undo everything trump did two years to fix everything trump has done two years to make sure we never ever have to go thru this again and of course covid and kids in cages and paris climate and endangered species and our protected land","covid",1090041105129840640,"",3047,255700,0,65,"",NA,NA,"","2021-01-06"
1346818686854832128,"core of the problem is states should have money for this but because of bad spending policies and then getting slammed by covid many states dont have the budget to set up proper administration trump picked a very silly time to make a point about spending habits it backfired","covid",1346811587781402624,"",0,15,0,0,"",NA,NA,"","2021-01-06"
1346818679766454272,"let trump continue to let americans die from covid and ignore russian hacking of our government","covid",1342228944272158720,"",24,778,1,0,"",NA,NA,"","2021-01-06"
1346818642957111296,"republicans turn on trump after georgia loss all the covid dead amp dying americans had no effect on corrupt rep members via","covid",172573744,"",2375,121721,0,0,"",NA,NA,"","2021-01-06"
1346818635407519744,"its just that every conspiracy theorist ive come across denies covid exists wont wear a mask believes david ikes lizard rubbish is a trump supporter is anti blm etc etc","covid",739094150075813888,"",16541,421402,0,1,"",NA,NA,"","2021-01-06"
1346818578293673984,"if not that covid19 kills the rich too celebrities wont bother seun kuti kidd biden senate trump","covid",313192451,"",723,25299,2,0,"",NA,NA,"USA","2021-01-06"
1346818577240895488,"meat packers were literally forced to remain on the job by decree of the trump administration to keep meat production humming while covid19 cases in the industry exploded now the state is saying that they shouldnt even be given access to the vaccine","covid",962777100,"",286,39123,0,162,"",NA,NA,"","2021-01-06"
1346818536157700096,"trumps report card added 8 trillion to national debt 42 reversed 80 epa regs withdrew from 13 int orgs appointed 225 judges signed 2017 tax law amp paid 750 mismanaged covid amp 355k died visited his properties 422 times pocketed 20m at his properties told 26k lies","covid",132513054,"",6656,194932,0,30,"",NA,NA,"","2021-01-06"
1346818525529313280,"trump had instant access to exclusive antibody meds and a private hospital when he had covid you or me would get paracetamol the same man who said he would bang his daughter makes sense to believe this man","covid",1258082291370397696,"",254,3502,2,0,"",NA,NA,"","2021-01-06"
1346818466955882496,"coronavirus america is getting ready to do the unthinkable ration health care because trump failed to control covid biden taking over cant come soon enough we must finally confront this deadly disease get it under control asap save lives and get everyone back to work","covid",793257137866768384,"",3094,14153,2,0,"",NA,NA,"USA","2021-01-06"
1346818450530979840,"the covid19 pcr tests are fake the models were fake now a coronavirus truthergrifter is speaking at the trump rally","covid",732971256,"",8961,118502,0,556,"",NA,NA,"","2021-01-06"
1346818445111824384,"america owes a huge debt to stacey for what shes done now biden can choose the ag he wants and cabinet members and judges and the doj and pursue criminal charges against the seditious trumplicans purjury money laundering blackmail collusion etc etc amp deal with covid","covid",1325138549423792128,"",10,1656,0,0,"",NA,NA,"","2021-01-06"
1346818422714339328,"kenya to procure 24 million doses of covid19 vaccine by february health cabinet mutahi kagwe says 24 million doses of covid19 vaccine will be in the country by the second week of february dr dre ozil mike sonko trump democrats","covid",4875021449,"",1704,25286,0,0,"",NA,NA,"","2021-01-06"
1346818407237238784,"auspol morrison suffers poor judgement trump response to covid climate change china the economy in fact he gets few if anything right he is arrogant a know all a liar superficial condones corruption he is lazy and his beliefs fraudulent and self serving","covid",1116967002,"",261,2215,0,270,"",NA,NA,"","2021-01-06"
1346818401721872384,"expand scotus impeach trumpappointed federal judiciary statehood for dc statehood or independence for puerto rico abolish ice end the electoral college tear down the wall open the borders rejoin paris nationwide covid policy healthcare green new deal doit","covid",2296406126,"",33,3157,0,63,"",NA,NA,"OK","2021-01-06"
1346818387062763520,"yeah it came from china but it wasnt chinese scientists creating the virus in a lab for evil purposes as trump supporters like to espouse and that was my point dumb has been the trump administration response to covid19 including the incompetent vaccine distribution","covid",3751707496,"",1579,4211,1,0,"",NA,NA,"USA","2021-01-06"
1346818368796585984,"so if trump calls covid the china virus can we call the new variant b117 the bojo virus","covid",193130354,"",1688,5747,7,0,"",NA,NA,"","2021-01-06"
1346818325041410048,"the awesome jacinda ardern moves new zealand to all but life as normal 5 months ahead of plan after 17 national covidfree days every success jacinda ardern achieves magnifies the failure of the west and in particular of boris johnson and donald trump","covid",85357015,"",3656,35856,0,15,"",NA,NA,"","2021-01-06"
1346818320213938176,"at what point has trump stood up to china was it the trade deal where they wont even do half of what was promised or when covid hit and he was on his knees praising xi the current gop runs on myths they dont stand for anything","covid",234775568,"",874,82818,1,0,"",NA,NA,"TX","2021-01-06"
1346818260612894720,"trump devils are in dc today on behalf of their crime boss who is almost always in the wrong amp now as usual he cant resist stirring up trouble amp worse spreading killer covid while at it then wonders why he lost as he dmn well deserved to trumplost2020","covid",1279668507072962560,"",81,1057,0,0,"",NA,NA,"","2021-01-06"
1346818259530764288,"he was skeptical of covid19 now from his hospital bed he posts videos on social media urging others to wear their masks covid19 vaccination antivax wednesdaythought trumpvirus antimask maskup trumpliedpeopledied","covid",88536854,"",192,4452,0,0,"",NA,NA,"","2021-01-06"
1346818240786427904,"wearing a mask in no way will guarantee you wont get covid thats not the point the point is the more people who wear masks the less the virus will be able to spread and less people will be sick its doing your part for team which trump doesnt seem to understand","covid",886004179206057984,"",1735,31617,0,0,"",NA,NA,"","2021-01-06"
1346818224525111296,"thank you georgia thank you true americans thank you god we can now work to heal stop the deaths of covid undo policies designed to lift up the rich amp stomp on the poor amp we can be 1 with our allies again byebyetrump mitchslapped senateflippedblue georgiansvoted","covid",118491454,"",3790,138096,0,25,"",NA,NA,"","2021-01-06"
1346818218917326848,"neonazi troll baked alaska claims he tested positive for covid19 hes been in the middle of trump protests throughout the day without a mask","covid",1220937768077012992,"",70,11839,0,194,"",NA,NA,"","2021-01-06"
1346818206246313984,"president donald trump all but guaranteed such suffering for some of his most fervent supporters when despite the existence of the new covid19 strain he urged the maga masses to congregate in washington to protest joe bidens victory","covid",63144098,"",24694,214012,0,1,"",NA,NA,"USA","2021-01-06"
1346818150726299648,"trumps covid consequences gopdeathcult","covid",827327176613715968,"",533,8212,0,0,"",NA,NA,"IL","2021-01-06"
1346818143361097728,"as of right now we are over 350000 deaths due to covid but thats not are main concern that 600 dollar stimulus and what president trump is going to do after january 20 is more important then covid19","covid",979529406006878208,"",27,462,0,0,"",NA,NA,"","2021-01-06"
1346818138902589440,"covid19 desatan is just another evil trump republican remember this when its election time cnn ron desantis craven dodge on covid via","covid",1144362608692269056,"",85,1536,0,0,"",NA,NA,"USA","2021-01-06"
1346818084053659648,"i stole this from becausewellits perfect maga magaiscancelled trump trumpmeltdown trumpcrimefamily wearamask wearadamnmask covid covid19 coronavirus gop gophypocrisy gopseditioustraitors gopsedition trumpispathetic trumpfailedamerica biden","covid",1042228017374928896,"",252,37298,0,178,"",NA,NA,"","2021-01-06"
1346818071185428480,"guy whos so inept hes allowed covid 19 to run unchecked throughout our country says what absolutely looking forward to january 20th when america will see joe biden sworn in as the 46th president of the usa trumplied352kamericansdied 46thpresidentelectjoebiden","covid",1268692168736030720,"",30,7428,0,0,"",NA,NA,"","2021-01-06"
1346818049018634240,"donald trumps covid19 plan feb covid isnt real mar itll go away apr itll go away may itll go away jun itll go away jul itll go away aug itll go away sep itll go away oct still holding superspreader rallys","covid",25690115,"",652,45762,0,0,"",NA,NA,"","2021-01-06"
1346818008925220864,"what happens when you follow a narcissist cult leader and listen to right wing media trumpism kills","covid",497877603,"",92,21835,0,0,"",NA,NA,"","2021-01-06"
1346817915396493312,"the pandemic wasnt an unlucky handicap for trump it was a massive gift it shouldve handed him reelection look how much respect cuomo got just for looking like he took it seriously look at the bump w got from 911 even though he was far more to blame than trump for covid","covid",1332463681,"",88,4011,0,53,"",NA,NA,"","2021-01-06"
1346817894735360000,"hey trump remember covid oh im sorry you like the baby names so remember the china virus yeah still killing great numbers of americans think you use a little of your time on that maybe put your golf clubs down dumptrump","covid",966840171693068288,"",272,916,1,0,"",NA,NA,"USA","2021-01-06"
1346817888246611968,"id say trump single handedly blowing up covid relief negotiations and then delivering 2000 checks if we win talking point to dem candidates hurt rs more than the call rs have two modes on this pathetic coup attempt 1 do it 2 dont do it because it will fail","covid",542538358,"",37,8618,0,0,"",NA,NA,"","2021-01-06"
1346817850791653376,"hmmm lotta red states at the top of that list oh i see youre a trump sheep with zero idea of whats actually happening anywhere","covid",2255100512,"",46,11120,0,0,"",NA,NA,"LA","2021-01-06"
1346817844953165824,"the people of the united states have lost 357000 souls to the covid 19 virus donald trump carries a huge responsibility based upon either gross incompetence or negligence yea we know the political stuff but here in the mi8 we are angry","covid",15636342,"",1513,69251,0,2,"",NA,NA,"OH","2021-01-06"
1346817839936712704,"i do remember trump running around giving covid to everyone your in fantasy","covid",1198929318958817280,"",247,5652,1,0,"",NA,NA,"","2021-01-06"
1346817824061353984,"yep all trump had to do was take covid a tiny bit seriously and all mcconnell had to do was throw folks two crumbs instead of one but instead theyll blame each other which is ok","covid",935721956,"",575,5970,2,0,"",NA,NA,"","2021-01-06"
1346817781187162112,"a queer and black man are about to take down trump amp the republican party factsdomatter lifeisgood trump maga proudboys gop march georgia covid","covid",748080476,"",1186,20893,0,0,"",NA,NA,"CA","2021-01-06"
1346817765445754880,"jon ossoff to georgians ill be for you cbs a queer and black man are about to take down trump amp the republican party factsdomatter lifeisgood trump maga proudboys gop march georgia covid","covid",1345869035523743744,"",23,1211,0,1,"",NA,NA,"","2021-01-06"
1346817761587163136,"im not getting any of the vaccines no way im following trumps plan drinking bleach getting light beamed myself and if i get covid ill send a google maps pin to marine 1 for my ride to walter reed or maybe i wont be a moron and ill get a shot its a coin flip","covid",714779804017565696,"",81,2838,1,0,"",NA,NA,"","2021-01-06"
1346817753357938688,"how does maga handle reality today georgia turning all blue police do actually mace maga and proud boys biden gets a step closer to being president hot dogs and pretzels run out covid still available no cheese being served as trump whines","covid",1282009591744733184,"",158,4486,2,0,"",NA,NA,"USA","2021-01-06"
1346817700400652288,"and today our capital city is filled with trump cultists intent on starting violence and creating havoc and the cult is there to spread covid with trump egging them on heartbreaking and very very dangerous","covid",39811050,"",364,63200,0,0,"",NA,NA,"VA","2021-01-06"
1346817682654560256,"my only question is if people are dyingwhy not give them the meds that trump got are you withholding a treatment lets eradicate covid19 ","covid",1131951800,"",408,10454,0,17,"",NA,NA,"NC","2021-01-06"
1346817663650078720,"you bet on trump being reelectedyou neglected your job you are personally responsible 4deaths in az az currently has the highest percapita rate of new covid19 infections with 785 cases per 100000 people over the past seven days","covid",102804703,"",13292,57825,0,0,"",NA,NA,"","2021-01-06"
1346817646537416704,"you lost the election loser wheres your healthcare plan how about the covid crisis that you lied about downplayed contracted amp spread 21m infected 357k dead failedgop loserinchief trumpliedamericansdied trumpisanationaldisgrace","covid",1345712193950646272,"",2,111,0,0,"",NA,NA,"","2021-01-06"
1346817643337027584,"so mitch mconnel is out trump is out all three branches of government are basically democrat most of you got what youve all been complaining about now lets see if they pass any more help for americans in response to covid or if nothing changes and its all just the same crap","covid",585140793,"",300,18691,3,0,"",NA,NA,"","2021-01-06"
1346817615138873344,"the outbreak has been linked to the slew of rallies that trump did in the weeks before the nov 3 presidential election and has sidelined approximately 10 percent of the agencys core security team the washington post reported friday","covid",478005884,"",738,48837,0,4,"",NA,NA,"USA","2021-01-06"
1346817605542277120,"congress live updates lawmakers to count electoral college votes affirming bidens win in face of republican challenges i think youll need stop bitchen about the fake fraud garbage that trump has been thrown out you need to worry more about the covid","covid",1337241441869959168,"",1,228,0,0,"",NA,NA,"","2021-01-06"
1346817594603560960,"he deserves to be in inauguration in office trump got corruption and covid19 virus spreading over this nation its time top stop the racism all lives matter","covid",1112085632627757056,"",148,416,0,0,"",NA,NA,"","2021-01-06"
1346969786673225728,"trump im going to go to my scotland property the last day of my term so i cant be arrested scotland declares month long total lockdown and bans international travel until february 1 well played scotland well played nationallockdown trumptapes","travel",726799391433052160,"",313,21463,0,10478,"",NA,NA,"","2021-01-06"
1346969766695641088,"breaking via wh press pool press pool reporter says nothing new at the white house and no word on when we will have a lid wrt uscapitol protest a travel photo lid would end the day in terms of journalists potential interaction with trump capitol capitolhill","travel",80483638,"",826,51500,0,0,"",NA,NA,"","2021-01-06"
1346911933400711168,"if it was africa travel advisories would be flying left right and centre and troops would be landing as fast as you can say trump won the election cnn where you ","travel",217351939,"",5429,16770,0,1,"",NA,NA,"","2021-01-06"
1346911817088389120,"in the theatrics of trumps soft coup we shouldnt lose sight of the larger goal of his project to preserve a white majority in america delegitimizing the voting process along with his travel ban border wall visa restrictions etc is a means to this end","travel",33552828,"",290,41290,0,56,"",NA,NA,"","2021-01-06"
1346911768971456512,"look blm has nothing to do with the hate displayed at the capitol blm is for equality for minorities we cant stand trump and his racism what makes you think we would travel and chance being locked up for a racist person you sound ignorant we are celebrating georgia","travel",1137549018039508992,"",68,1358,0,0,"",NA,NA,"FL","2021-01-06"
1346911600012271616,"hold trump mitch rudy giuliani and ted cruz accountable will au eu china russia uk nato consider visatravel bans utter mess","travel",173747504,"",1449,40801,0,3,"",NA,NA,"","2021-01-06"
1346911507427196928,"to anyone saying these traitors arent representative of most trump supporters yes they are these are just the ones that were willing to travel","travel",281910300,"",935,93758,0,2,"",NA,NA,"","2021-01-06"
1346911422236692480,"scotlands leader says trump isnt welcome to visit his turnberry resort because golfing isnt essential travel","travel",134178084,"",330,14858,0,45,"",NA,NA,"","2021-01-06"
1346911014554533888,"especially as trump whitehouse issues guidance on restricting the travel of antifa","travel",233752102,"",1116,2020,1,0,"",NA,NA,"","2021-01-06"
1346910956031365120,"enough is enough if youre still a supporter youre a fucking traitor the national guard and state troopers should arrest everyone at the capitol then arrest trump","travel",24559714,"",22698,5156,0,1503,"",NA,NA,"","2021-01-06"
1346910863358234624,"you telling me black amp brown people protest peacefully and are violently attacked with rubber bullets tear gas etc but trump supporters can aggressively break in the capitol and the police dont use the same excessive violence and force","travel",805559809445478400,"",3072,43994,0,269,"",NA,NA,"","2021-01-06"
