"tweet_id","text","query","user_id","user_name","follower_count","user_tweet_count","likes","retweets","location_name","latitude","longitude","user_location","date"
1346802991823785984,"the trump train is rounding its final destination it will be arriving at the unemployment line before finally ending its route at ny state prison please keep your hats inside the vehicle and heads up each others ass while exiting single file","unemployment",1325244089462296576,"",994,744,0,0,"",NA,NA,"FL","2021-01-06"
1346802678987280384,"yeah we could have hundreds of thousands of preventable deaths massive unemployment and rioting in the streets oh wait we have that under trump right now","unemployment",810683582498897920,"",7,3313,17,0,"",NA,NA,"","2021-01-06"
1346802545319145472,"i think its pretty difficult to look at this chart and say that trump was responsible for increasing black employment rates","unemployment",725966129785626624,"",306,9011,0,0,"",NA,NA,"","2021-01-06"
1346802497252438016,"this is a ca issue not created by trump other states are already dishing out their unemployment with the stimulus added contact and put blame where blame us due","unemployment",1342963277073182720,"",4,32,5,0,"",NA,NA,"TN","2021-01-06"
1346800688580481024,"show your figures or shut the hell up trump has increased the deficit and the dow jones rose more under obama obama also cut unemployment in half over his tenure","unemployment",9786032,"",7960,88666,1,0,"",NA,NA,"","2021-01-06"
1346800616710885376,"who presided over the worst unemployment rate in america worst economy who killed 350k americans donald trump","unemployment",42751425,"",493,37033,2,0,"",NA,NA,"AZ","2021-01-06"
1346799888567214080,"donald trump caused a delay in vaccine distribution because he denied accepting vaccines from pfizer he caused millions of americans needed assistance in unemployment benefits and allowed us to live on 600 for 10 months in a pandemic success","unemployment",2720435689,"",201,4459,0,0,"",NA,NA,"","2021-01-06"
1346798904990461952,"because trump is the true rino here he is a conspiracy theorist that prefers authoritarianism gop is why expanded unemployment benefits ended in july dems were ready to extend in may and june","unemployment",64737287,"",99,7194,0,0,"",NA,NA,"","2021-01-06"
1346798646919102464,"youre good with 330k dead and inaction on the pandemic 67 unemployment due to inaction on unemployment trillion dollar deficit trying to overturn an election you realize trump and biden arent far apart in age so our choices were literally 2 old a white men","unemployment",225985524,"",15756,61045,0,0,"",NA,NA,"NC","2021-01-06"
1346798272443080704,"trump lost bama no go stand in the unemployment line geek","unemployment",843932604,"",18,179,0,0,"",NA,NA,"","2021-01-06"
1346798063470436352,"trump didnt do anything with the vaccine and not sure if youve noticed there is still record unemployment","unemployment",78509284,"",167,15692,0,0,"",NA,NA,"","2021-01-06"
1346797752555077632,"dont worry on january 20th trump will join then on the unemployment line as well","unemployment",27037459,"",121,11798,0,0,"",NA,NA,"USA","2021-01-06"
1346797586586476544,"thank you donny for your help trumps 4 years of criminality then his desperation to become king cinched his defeat and all who drank his koolaid dems should warn all magats 2022 and 2024 we will put the rest of their racist behinds on the unemployment line","unemployment",827068694530387968,"",440,122183,0,0,"",NA,NA,"","2021-01-06"
1346796038770704384,"time for your unemployment hope you stop lying for the sake of your child trumpisalaughingstock and so are you","unemployment",820352939051118592,"",46,639,0,0,"",NA,NA,"","2021-01-06"
1346795703532736512,"you mean the long long unemployment line created by trump youll have lots of company with all the people trump put out of work","unemployment",871420143104086016,"",15,165,0,0,"",NA,NA,"","2021-01-06"
1346793546012123136,"will we find trump at walmart or burger king unemployment your threats are oh so scary given that your side keeps losing elections amp lawsuits bigly eric trump got it right maga is going nowhere keep yelling though so tough lol","unemployment",207588299,"",708,104158,0,4,"",NA,NA,"","2021-01-06"
1346791214977331200,"so now that the gop and dems ousted trump we can finally get back to the status quo financing everyone but us citizens corporations being enthroned politicians are for sale again warconflicts higher unemployment sold to you and me by the media what a relief","unemployment",2183237903,"",274,9841,1,0,"",NA,NA,"USA","2021-01-06"
1346789045419057152,"trump inherited the decreasing black unemployment from the obama administration lets not stroke his cock with lies","unemployment",951673444197945344,"",6530,42509,0,1,"",NA,NA,"FL","2021-01-06"
1.346788416202e+18,"fuck eric trump and his family for causing death sickness unemployment in my community georgia maga foxnews oann","unemployment",1346700011598270464,"",376,3040,0,4,"",NA,NA,"CA","2021-01-06"
1346787412178038784,"the richest 5 percent of americans received more in trump tax cuts in 2020 145 billion than congress is spending on increased unemployment benefits for millions of americans during the economic crisis 120 billion","unemployment",4889739844,"",3,184,0,1434,"",NA,NA,"","2021-01-06"
1346787059919450112,"what part of the economy did you hate lowest unemployment rates in history lowest interest rates low gas prices rising wages deregulation tax cuts answer without saying the word trump","unemployment",24090115,"",38,1087,0,0,"",NA,NA,"","2021-01-06"
1346786825948573696,"loeffler amp purdue you do know that trump has an anti following right former republicans want either republicans with a spine or a democrat guess well take the democrats and yall trump and loeffler thats georgia speak will be filing for unemployment","unemployment",3392086272,"",1,105,0,0,"",NA,NA,"","2021-01-06"
1346786109523718144,"back to what president trump had the lowest unemployment record in history","unemployment",453368938,"",1221,25213,1,0,"",NA,NA,"TX","2021-01-06"
1346783826798788608,"stop representing trump and start representing missourians won in a free and fair election do not ignore the will of the people focus on helping missouri during the pandemicincreased help for unemployment healthcare ampeducation","unemployment",1397647237,"",3287,20568,0,0,"",NA,NA,"","2021-01-06"
1346779607916285952,"people are in the unemployment line nowbecause of trump this is trumps america til 12021","unemployment",837482234957467648,"",2169,4654,0,0,"",NA,NA,"","2021-01-06"
1346777726422835200,"remind me again what has done to the deficit wheres unemployment how many billions went to bailout farmersa socialist program btw fiscal conservatism has gone out the window under trump","unemployment",1162076328256032768,"",6,3771,0,0,"",NA,NA,"","2021-01-06"
1346776185070608384,"time for trump to visit unemployment","unemployment",186779831,"",12,187,0,0,"",NA,NA,"FL","2021-01-06"
1346772613176160256,"youre a complete idiot arent you before the china virus the trump administration had the best economy the lowest unemployment in over 50 years was bringing millions of jobs back that obama biden sent away you need to stop believing everything cnn is telling you youre fool","unemployment",890936346050777088,"",3,499,0,0,"",NA,NA,"OH","2021-01-06"
1346769925629743104,"let me educate you there alf i love the way you do the whole republicans with the 3 ks ha ha do you understand that the unemployment rate for every minority was the lowest in history under trump that is a weird way of being racist","unemployment",455186882,"",79,16838,0,0,"",NA,NA,"SC","2021-01-06"
1346769830670725120,"this is horrible im ashamed to have you as a senator i hope this tactic doesnt get you guys anywhere but on the unemployment line in a few years its shameful the unnecessarily divide trump continues to put our country through","unemployment",1465489741,"",89,692,6,0,"",NA,NA,"NC","2021-01-06"
1346769829055893504,"yeah how dare trump make us great we demand obama era failing economy with record black unemployment","unemployment",1131646596184256512,"",15,763,0,0,"",NA,NA,"","2021-01-06"
1346769390222495744,"president obama created an average of 27 thousand american jobs each week of his presidency trump lost an average of 15 thousand american jobs each week of his biden will reduce unemployment in his presidency so the republicans can shut up about being job creators in 2024","unemployment",127258729,"",3299,130268,0,99,"",NA,NA,"WA","2021-01-06"
1346769249176576000,"1 add 1400 to stimulus checks and increase additional unemployment to 600 2 pass voting rights act 3 police reform 4 repeal trump tax cuts 5 immigration reform 6 infrastructure 7 prosecute trump and all criminal republicans","unemployment",34160726,"",2694,29363,3,0,"",NA,NA,"","2021-01-06"
1346767802301083648,"the america left has had a taste of south african style socialism and want more get ready for more unemployment more corruption more segregation more govt interference more govt control stopthesteai2021 trump geogia wednesdaythought","unemployment",1107560962477969408,"",514,4003,0,0,"",NA,NA,"","2021-01-06"
1346764240921780224,"obama also came into office amidst the worst recession since the great depression with consumers and businesses having massive debt trump came into office amidst falling unemployment and financially healthy consumers and businesses obama won reelection trump lost reelection","unemployment",2318158573,"",18,1723,0,0,"",NA,NA,"","2021-01-06"
1346764068082823168,"trump i cant sign this bill because its not good enough trump waits a week millions lose unemployment benefits congress changes nothing trump im signing this bill","unemployment",843864736647200768,"",7225,85823,0,234,"",NA,NA,"","2021-01-06"
1346761052130693120,"shhh kristen this group has a fact allergy they dont want to know that under mcconnelltrump we have had record drops in gdp record unemployment record deficits record redistribution of wealth","unemployment",20615783,"",184,7766,2,0,"",NA,NA,"","2021-01-06"
1346760758579834880,"vote trump niqqa we be preachin dis all day homie ayeeeee og shit no cap yo lemme tell u sum bout black unemployment ya heard","unemployment",1294383390502850560,"",30,492,1,0,"",NA,NA,"","2021-01-06"
1346758216349175808,"remember when howled in unison about nancy pelosis taste in ice cream amp called her fancynancy the people face thousands of covid deaths per day trump vetoes stimulus amp then goes golfing at his florida resort while pence goes skiing at vail","unemployment",894425176216961024,"",961,79197,0,1,"",NA,NA,"CA","2021-01-06"
1346755728019742720,"yet its ironic how president trump had and has more support of and did more for black people as you say with the lowest unemployment in history obama and biden has 8 years and accomplishment nothing why is that","unemployment",738511966310961152,"",12,5010,0,0,"",NA,NA,"NH","2021-01-06"
1346754615572742144,"you trumpers better get in line for unemployment cause the game is over","unemployment",1358683796,"",159,5201,0,0,"",NA,NA,"","2021-01-06"
1346753447203393536,"thats the point trump isnt one of those lieing smooth talking political people he came to fix the economy because he knows business america was at an all time high economy and very low unemployment when the covid appeared","unemployment",590495982,"",27,389,0,0,"",NA,NA,"","2021-01-06"
1346751768588406784,"yea and you are fired in just 14 day thanks to and so best get packing byekayleigh enjoy unemployment trumptapes trumpmeltdown trumpbeggedlikeadog 11780 trumpisalooser trumpisanationaldisgrace bidenharris2020","unemployment",28976013,"",637,3898,0,0,"",NA,NA,"USA","2021-01-06"
1346751570717929472,"you will lose in court just as trump did plus you will have one more thing to talk about with trump in the unemployment line","unemployment",1060967901451165696,"",2675,2370,1,0,"",NA,NA,"","2021-01-06"
1346749925841899520,"bye byeyou can stop nowhumans with brains will be coming soon120 specifically and you can sink into irrelevance write a book that no one will buy and file for unemployment until trump tv launches at which point you can read scripts again good riddens","unemployment",91344106,"",10,3817,0,0,"",NA,NA,"","2021-01-06"
1346749635931602944,"much more important is to pass an unemployment supplement retroactive to the beginning of september when the trumpfema 300week boost expired many have fallen behind on rent and bills because congress couldnt get together and pass a bill its time to let them catch up","unemployment",1036018678435864576,"",66,6811,1,0,"",NA,NA,"","2021-01-06"
1346794512803377152,"declared hater of settler colonialism here the oslo accords do not trump the geneva conventions israel is duty bound as the occupying regime to provide the vaccine for those it occupies working with the local authorities see article 56 of the 4th geneva convention","vaccine",1076853402859171840,"",61,108,0,58,"",NA,NA,"","2021-01-06"
1346794353616953344,"trump lost the presidency the senate and control of covid and biden beat him with more votes and reversed electoral college losses senate controlled by democrats warnock first black senator of georgia ossoff first jewish senator of georgia vaccine coming hopefortheday","vaccine",839806306127052800,"",510,23471,0,9,"",NA,NA,"","2021-01-06"
1346794351775473664,"presidentelect joe biden will call out the trump administration on the pace of vaccine distribution in remarks later today","vaccine",1324037020495171584,"",1,30,0,123,"",NA,NA,"","2021-01-06"
1346794248423747584,"you screwed this part up to just go trumpvaccinemia wheresmyjab","vaccine",14954716,"",72,798,0,0,"",NA,NA,"","2021-01-06"
1346793842780069888,"unionists generating faux grievance and outrage over a snhs referring to the astrazeneca vaccine as such because scots hate the english when even the uk gov calls it that like you couldnt make it up its positively trumpian","vaccine",3240401608,"",345,21154,0,2,"",NA,NA,"","2021-01-06"
1346793531898212352,"bullshit you and your team didnt develop a vaccine everyone knows it the only one that was worth having was dr fauci thank god joe biden has him you have been a terrible vp caving to trumps every demand no spine of your own goodbye amp good riddance","vaccine",265247535,"",5137,29553,0,0,"",NA,NA,"FL","2021-01-06"
1346793393490440192,"in 2021 1 we got the covid vaccine 2 clemson lost badly to ohio state after years of trash talk 3 trump will be evicted from the white house 4 i won the bowl challenge against my family 5 warnock and ossoff won georgia 6 hornets have lamelo its getting better fam","vaccine",476448836,"",273,21252,2,0,"",NA,NA,"NC","2021-01-06"
1346793369058430976,"gotta trumpet the app because actual vaccine is so far away and great leaders govt must stay in the news at all times","vaccine",145181602,"",7,204,2,0,"",NA,NA,"","2021-01-06"
1.346793261785e+18,"you all keep talking about a bernie sanders chairman position like its a bad thing this is exactly what americans want and need after the trump depression and trump mishandling of the pandemic and vaccine rollout","vaccine",1330598526565240832,"",18,617,0,0,"",NA,NA,"","2021-01-06"
1346793081098522624,"trumps administration has let us down sabotoging the vaccine are they trying to kill us","vaccine",1201204449378590720,"",160,26647,0,0,"Los Angeles, CA",-118.668404,33.704538,"","2021-01-06"
1346792829138432000,"trump has done a lot by fighting tooth and booth to make sure the vaccine was discovered lets appreciate him first he is worth being a president unlike those that go about stealing votes","vaccine",1335376843302637568,"",171,152,1,0,"",NA,NA,"","2021-01-06"
1346792516415336448,"results from georgias senate runoffs the latest on trumps election efforts whenwhere publix will offer the coronavirus vaccine and more","vaccine",1258051184,"",304,1724,0,2,"",NA,NA,"","2021-01-06"
1346792485637525504,"ron desantis is trumplite he is modeling himself after trump not taking any responsibility for covid running rampant in our state or poor vaccine rollout put your support behind someone with more moral character","vaccine",18905974,"",45,1438,13,0,"",NA,NA,"FL","2021-01-06"
1346792334659346432,"357000 dead americans trumpvirus the vaccine rollout has been a disaster","vaccine",825136267755155456,"",354,19022,14,0,"",NA,NA,"USA","2021-01-06"
1346792327050895360,"i think you need to go vaccine to english classes and learn how to spell trump is the current potus but not for much longer and considering he has shown a complete disregard for anyone except himself nicole sturgeons response is entirely correct and justified","vaccine",302511287,"",10,11,0,0,"",NA,NA,"","2021-01-06"
1346792251104620544,"seniors sleeping in cars to get vaccinated restaurants forced to sell frozen entrees americans inquiring moving out of the country ambulance crews told not to transport people with little chance of survival virus growth outpaces vaccinethis is trumps world","vaccine",58998446,"",1257,5329,0,0,"",NA,NA,"FL","2021-01-06"
1346792107961421824,"wednesday news trumps false election fraud claims face a dead end in congress with georgia wins dems on verge of a trifecta thank you stacey abrams trumps parting gift gop civil war virginias sluggish vaccine rollout needs explanation","vaccine",18067507,"",1586,40508,0,4,"",NA,NA,"VA","2021-01-06"
1346792080102797312,"i have no problem calling out but had months to plan a statewide vaccine rollout and his plans not going much better than trumps nonexistent one you cant grab all of the decisionmaking power write a book on leadership then blame everyone else","vaccine",51800099,"",283,41727,0,523,"",NA,NA,"","2021-01-06"
1346791717870174208,"trumps america looking more and more like a banana republic no national vaccine rollout plan and republicans rioting in the streets of the capital","vaccine",326721022,"",1997,76173,0,2,"",NA,NA,"","2021-01-06"
1346791634000818176,"the maga creed 1 the pandemic scare is a hoax 2 but trump deserves all credit for any vaccine 3 and a vaccine must be called the trump vaccine 4 and theres no way im taking that goddamned vaccine","vaccine",47102050,"",2057,47197,0,1007,"",NA,NA,"USA","2021-01-06"
1346791601591496704,"vaccine rollout simplified trump whhhs ships amp punts off rollout to states states often punt off to counties local countiescities often punt to local hospitals and clinics local hospitalsclinics were already overwhelmed here covid19","vaccine",18210636,"",2639,218785,0,1850,"",NA,NA,"","2021-01-06"
1346791323744030720,"another failure by you as a gov with the rollout of the trump vaccinefirst the nursing home disasteramp now the rolloutits amazing how you amp deblasio are so incompetent at everything you doflorida having no issues with the vaccine but ny cant figure it outanother dem shitshow","vaccine",1038162392058875904,"",35,2393,0,0,"",NA,NA,"NY","2021-01-06"
1346791083196391424,"trumpvirus infected goppos and there is no vaccine","vaccine",1152733044,"",1865,27953,1,0,"",NA,NA,"","2021-01-06"
1346790937628979200,"i am a nurse i know medical personnel refusing the vaccine trump is a massmurderer","vaccine",35361159,"",301,10594,2,0,"",NA,NA,"OH","2021-01-06"
1346929533774159872,"i call on president trump to go on national television now to fulfill his oath and defend the constitution by demanding an end to this siege","president",939091,"joe biden",23874901,7110,1070310,107895,"",NA,NA,"DE","2021-01-06"
1346960922615685120,"the man directly responsible for the chaos of today is donald trump who has made it clear that he will do anything to remain in power including insurrection and inciting violence trump will go down in history as the worst and most dangerous president in history","president",216776631,"bernie sanders",14386977,19352,582501,114421,"",NA,NA,"VT","2021-01-06"
1346969798039777280,"phone is blowing up with republicanpro trump friends amp contacts all saying essentially the same thing they are shocked amp incredibly embarrassed by what happened at the capitol today and they no longer support the president trump voters has today changed anything for you","president",1044727375982923776,"",3501,14288,0,1026,"",NA,NA,"","2021-01-06"
1346969797959946240,"vermont governor phil scott a republican president trump should resign or be removed from office by his cabinet or by the congress","president",2148975431,"",82,876,0,420,"",NA,NA,"NY","2021-01-06"
1346969797838340096,"inbox the naacp is calling for the immediate impeachment of president donald trump for his attempted coup on the united states of america","president",1048030356283174912,"",18,2377,0,15520,"",NA,NA,"","2021-01-06"
1346969797821534208," just reporting that a close close friend of the presidents who has been in constant contact with the president today just said about trump hes out of his mind remove him now","president",329513070,"",103,20475,0,2403,"",NA,NA,"","2021-01-06"
1346916179529658368,"this is insane the president needs to call it off call it off the elections over i havent seen anything like this since ive been deployed to iraq we dont think the other countries are sitting back and watching call it off gop trump supporter","president",240417457,"",493,17228,0,13,"",NA,NA,"KS","2021-01-06"
1346916179240251392,"trump should be removed from the white hous in chains theres no need for any more proof of sedition he called for this event he said he would lead them to the cap bldg then went back to wh and its entirely on him he is no longer a president but a terrorist arrest him","president",504898673,"",948,33138,0,5,"",NA,NA,"","2021-01-06"
1346916179072348160,"cnn needs to stop calling these trump supporters anarchists theyre not anarchist they just attended a rally called by the president united states theyre trump supporters theyre republicans this is the republican party under trump","president",144402222,"",14395,387933,0,602,"",NA,NA,"CA","2021-01-06"
1346916179063889920,"pressure is mounting on president donald trump to condemn supporters who are violently clashing with law enforcement on capitol hill among those urging trump to act his former communications director who tweeted that trump should condemn this now","president",16664681,"los angeles times",3769803,327274,203,50,"",NA,NA,"CA","2021-01-06"
1346916178942418944,"president trump incited a mob to storm the capitol to overturn the results of an american election thats not an exaggeration dont tell me this has not been a coup attempt dont tell me trump is not an enemy of the united states he has been since day 1","president",710755689,"",382,83134,0,12847,"",NA,NA,"","2021-01-06"
1346916178921365504,"supporters of president trump have breached the us capitol according to capitol police officers as lawmakers count the electoral college votes certifying presidentelect joe bidens win","president",3250990356,"",429,8806,0,4198,"",NA,NA,"","2021-01-06"
1346916178728529920,"rep mike gallagher who is a trump supporter on the phone with call this off mr president the election is over call this off when asked by jake what trump should tweet rep gallagher says he should tweet i support the peaceful transfer of power","president",860682266,"",87,12641,0,717,"",NA,NA,"","2021-01-06"
1346916178430627840,"i want you to look at this and remember every single elected official who defended president trump to the very end never let them get away with it","president",1192051717,"",299,11787,0,57,"",NA,NA,"","2021-01-06"
1346916178304884736,"i need to reup this because it speaks to whats happening at the capitol trumps demagoguing is to blame he will go down as the most corrupt dangerous president ever but his maga followers are the same dangerous unhinged racist undemocratic call them what they are","president",111105617,"",4508,93959,9,1,"",NA,NA,"","2021-01-06"
1346916178204241920,"cnn just called it an attempted coup by president trump and his supporters and that a woman has just been shot jesus christ","president",39607824,"",2536,90676,0,20,"",NA,NA,"","2021-01-06"
1346916177663037440,"a lot of people are making this observation about the only group trump has taken care of in his four years as president have been cops this is why he bought their inaction over four years","president",142394186,"",12661,6567,0,147,"",NA,NA,"","2021-01-06"
1346916177549819904,"i am safe we are sheltering in place make no mistake president trump and his enablers are directly responsible for this violence","president",1196459313109192704,"",20,1041,0,8442,"",NA,NA,"","2021-01-06"
1346916177231151104,"its time for trump to resign ill take 14 days of president pence","president",63538330,"",448,3578,1,0,"",NA,NA,"NY","2021-01-06"
1346916176941600768,"pres trump and his minions are trying a coup attemptthis is sedition president trump and a certain numbers of republican senators representatives have been heading dwn this path for 4 yrs and here we are i need black lives matter energy from law enforcement","president",1315111814515089408,"",31,1119,0,3445,"",NA,NA,"NY","2021-01-06"
1346916176912375808,"this is the us capitol right now this is what the words and actions of president trump have yielded","president",14209356,"",1780,7479,0,1088,"",NA,NA,"DC","2021-01-06"
1346916176903942144,"thousands of trump supporters have staged an attempted coup at the presidents urging breaching the halls of congress while elected officials were beginning to certify joe bidens presidential election win","president",1031993998628597760,"",5,286,0,134,"",NA,NA,"MN","2021-01-06"
